{
  "acquisitions": [
    "random-seeded-sha256-v1",
    "greedy-predictive-mean-v1",
    "uncertainty-bootstrap-std-v1"
  ],
  "batch_sizes": [
    8
  ],
  "budgets": [
    32
  ],
  "contract_status": "production",
  "dataset_manifest_sha256": "37938d62ec61c0ac912bfd49d690696d7b750f0a497558faf525a9b7d3e61643",
  "evaluation": {
    "access_boundary": {
      "owner": "evaluator-or-hidden-oracle",
      "prohibited_consumers": [
        "candidate-features",
        "surrogate-model",
        "calibration",
        "acquisition-strategy"
      ]
    },
    "aggregation": {
      "cross_task_equal_weight_metric_ids": [
        "spearman_rank_correlation",
        "high_value_recall_at_nominal_k",
        "high_value_discovery_recall",
        "success_probability"
      ],
      "pooled_seed_primary": false,
      "primary_unit": "task",
      "raw_unitful_cross_task_aggregate": false,
      "seed_role": "within-task-algorithmic-randomness"
    },
    "high_value_definitions": [
      {
        "candidate_role": "candidate-pool",
        "definition_id": "upper-tail-1pct",
        "derivation": {
          "fraction": 0.01,
          "nominal_k": 21,
          "rounding": "ceil"
        },
        "frozen_candidate_count": 2070,
        "kind": "quantile",
        "purpose": "primary",
        "ranking_policy": {
          "boundary_tie_policy": "include_all_equal",
          "duplicate_candidate_id_policy": "error",
          "label_direction": "higher_is_better",
          "non_finite_policy": "error",
          "secondary_order": "candidate_id_ascending"
        },
        "reporting_policy": {
          "required_outputs": [
            "nominal_k",
            "actual_high_value_count",
            "boundary_score",
            "boundary_tie_count"
          ]
        },
        "value": 0.01
      },
      {
        "candidate_role": "candidate-pool",
        "definition_id": "upper-tail-0.5pct",
        "derivation": {
          "fraction": 0.005,
          "nominal_k": 11,
          "rounding": "ceil"
        },
        "frozen_candidate_count": 2070,
        "kind": "quantile",
        "purpose": "sensitivity",
        "ranking_policy": {
          "boundary_tie_policy": "include_all_equal",
          "duplicate_candidate_id_policy": "error",
          "label_direction": "higher_is_better",
          "non_finite_policy": "error",
          "secondary_order": "candidate_id_ascending"
        },
        "reporting_policy": {
          "required_outputs": [
            "nominal_k",
            "actual_high_value_count",
            "boundary_score",
            "boundary_tie_count"
          ]
        },
        "value": 0.005
      },
      {
        "candidate_role": "candidate-pool",
        "definition_id": "upper-tail-2pct",
        "derivation": {
          "fraction": 0.02,
          "nominal_k": 42,
          "rounding": "ceil"
        },
        "frozen_candidate_count": 2070,
        "kind": "quantile",
        "purpose": "sensitivity",
        "ranking_policy": {
          "boundary_tie_policy": "include_all_equal",
          "duplicate_candidate_id_policy": "error",
          "label_direction": "higher_is_better",
          "non_finite_policy": "error",
          "secondary_order": "candidate_id_ascending"
        },
        "reporting_policy": {
          "required_outputs": [
            "nominal_k",
            "actual_high_value_count",
            "boundary_score",
            "boundary_tie_count"
          ]
        },
        "value": 0.02
      }
    ],
    "interpretation_policy": {
      "comparison_rule": "strict_sign_reversal",
      "primary_tie_expansion_fraction_limit": 0.02,
      "sensitivity_fractions": [
        0.005,
        0.02
      ],
      "triggered_status": "fragile-inconclusive"
    },
    "metric_sets": {
      "m2_static": [
        "spearman_rank_correlation",
        "high_value_recall_at_nominal_k"
      ],
      "m3_m5_sequential": [
        "best_found_value",
        "simple_regret",
        "high_value_discovery_recall",
        "success_at_budget"
      ],
      "task_seed_aggregates": [
        "success_probability"
      ]
    },
    "primary_high_value_definition_id": "upper-tail-1pct"
  },
  "experiment_id": "m3-ired-single-fidelity-replay-v1",
  "held_out_authorized": false,
  "initial_sample_sizes": [
    16
  ],
  "models": [
    "ridge-sklearn-v1",
    "random-forest-sklearn-v1",
    "xgboost-cpu-v1"
  ],
  "phase": "frozen",
  "processing_manifest_sha256": "929f0a46bfca015fb020bb7ebcc3a91e4de33922cd217399551b3dae1cc437ba",
  "schema_version": "2",
  "seeds": [
    1729
  ],
  "split_sha256": "9bff199ec81b9b5b1e0548c237b923b2ac7db1bf36382377ed36d30c042c725e",
  "task_id": "ired"
}
